{
	"$schema": "../../block-schema.json",
	"type": "paragraph",
	"name": "Paragraph",
	"description": "Add a paragraph of text",
	"icon": "bars-3-bottom-left",
	"category": "text",
	"keywords": ["text", "content", "body"],
	"version": 1,
	"public": true,
	"parent": null,
	"allowedChildren": null,
	"attributes": {
		"text": {
			"type": "rich_text",
			"source": "content",
			"default": ""
		},
		"alignment": {
			"type": "string",
			"source": "style",
			"default": "left"
		},
		"textColor": {
			"type": "string",
			"source": "style",
			"default": null
		},
		"backgroundColor": {
			"type": "string",
			"source": "style",
			"default": null
		},
		"fontSize": {
			"type": "string",
			"source": "style",
			"default": null
		},
		"dropCap": {
			"type": "boolean",
			"source": "style",
			"default": false
		}
	},
	"supports": {
		"color": {
			"text": true,
			"background": true
		},
		"typography": {
			"fontSize": true
		},
		"anchor": true,
		"className": true
	}
}
